{
  "version": "3.0",
  "scope": "Presentation plan, not a scenario engine or an independent domain state machine.",
  "atomicity": "A macro/atomic domain transition may have multiple explanatory shots. Never present them as separately committed domain states unless the engine actually exposes those states and tests prove them.",
  "notEveryFrameIsAStep": true,
  "checkpoints": [
    {
      "checkpointId": "infra-exhaustion-recovery-00",
      "scenarioId": "infra-exhaustion-recovery",
      "chapterId": "infra-exhaustion-recovery:stage-1",
      "stateRef": "scenarios/infra-exhaustion-recovery.json#/checkpoints/0/expected",
      "previousCheckpointId": null,
      "headline": "See the starting state",
      "motion": "hold",
      "outcomeFields": [
        "workloadStatus",
        "nodeId",
        "clientAvailable",
        "blockedReasons"
      ],
      "defaultPhaseMs": {
        "orient": 400,
        "focus": 250,
        "action": 850,
        "settle": 1100
      },
      "microbeats": [
        {
          "id": "infra-exhaustion-recovery-00:beat-1",
          "label": "See the starting state",
          "primaryActors": [
            "infra.node-02",
            "infra.workload",
            "infra.client"
          ],
          "routeKind": null,
          "layout": "triad",
          "claim": "visual explanation of the referenced domain transition; not a new commit or backend call"
        }
      ],
      "advancePolicy": "Complete all visible explanatory subbeats before the next guided command; this is pacing, never a domain success gate."
    },
    {
      "checkpointId": "infra-exhaustion-recovery-01",
      "scenarioId": "infra-exhaustion-recovery",
      "chapterId": "infra-exhaustion-recovery:stage-2",
      "stateRef": "scenarios/infra-exhaustion-recovery.json#/checkpoints/1/expected",
      "previousCheckpointId": "infra-exhaustion-recovery-00",
      "headline": "The host fails; the instance stops",
      "motion": "interrupt",
      "outcomeFields": [
        "workloadStatus",
        "nodeId",
        "clientAvailable",
        "blockedReasons"
      ],
      "defaultPhaseMs": {
        "orient": 400,
        "focus": 250,
        "action": 850,
        "settle": 1100
      },
      "microbeats": [
        {
          "id": "infra-exhaustion-recovery-01:beat-1",
          "label": "Stop the instance on node-02",
          "primaryActors": [
            "infra.node-02",
            "infra.workload"
          ],
          "routeKind": "control",
          "layout": "pair",
          "claim": "visual explanation of the referenced domain transition; not a new commit or backend call"
        }
      ],
      "advancePolicy": "Complete all visible explanatory subbeats before the next guided command; this is pacing, never a domain success gate."
    },
    {
      "checkpointId": "infra-exhaustion-recovery-02",
      "scenarioId": "infra-exhaustion-recovery",
      "chapterId": "infra-exhaustion-recovery:stage-2",
      "stateRef": "scenarios/infra-exhaustion-recovery.json#/checkpoints/2/expected",
      "previousCheckpointId": "infra-exhaustion-recovery-01",
      "headline": "Exclude the previous owner",
      "motion": "guard",
      "outcomeFields": [
        "workloadStatus",
        "nodeId",
        "clientAvailable",
        "blockedReasons"
      ],
      "defaultPhaseMs": {
        "orient": 400,
        "focus": 250,
        "action": 850,
        "settle": 1100
      },
      "microbeats": [
        {
          "id": "infra-exhaustion-recovery-02:beat-1",
          "label": "Confirm exclusion before a restart",
          "primaryActors": [
            "infra.controller",
            "infra.workload"
          ],
          "routeKind": "control",
          "layout": "pair",
          "claim": "visual explanation of the referenced domain transition; not a new commit or backend call"
        }
      ],
      "advancePolicy": "Complete all visible explanatory subbeats before the next guided command; this is pacing, never a domain success gate."
    },
    {
      "checkpointId": "infra-exhaustion-recovery-03",
      "scenarioId": "infra-exhaustion-recovery",
      "chapterId": "infra-exhaustion-recovery:stage-2",
      "stateRef": "scenarios/infra-exhaustion-recovery.json#/checkpoints/3/expected",
      "previousCheckpointId": "infra-exhaustion-recovery-02",
      "headline": "Start a new instance on node-01",
      "motion": "restart",
      "outcomeFields": [
        "workloadStatus",
        "nodeId",
        "clientAvailable",
        "blockedReasons"
      ],
      "defaultPhaseMs": {
        "orient": 400,
        "focus": 250,
        "action": 850,
        "settle": 1100
      },
      "microbeats": [
        {
          "id": "infra-exhaustion-recovery-03:beat-1",
          "label": "Read the preserved workload definition",
          "primaryActors": [
            "infra.controller",
            "infra.workload"
          ],
          "routeKind": "control",
          "layout": "pair",
          "claim": "visual explanation of the referenced domain transition; not a new commit or backend call"
        },
        {
          "id": "infra-exhaustion-recovery-03:beat-2",
          "label": "Start from durable data on the eligible node",
          "primaryActors": [
            "infra.storage",
            "infra.node-01",
            "infra.workload"
          ],
          "routeKind": "restart",
          "layout": "triad",
          "claim": "visual explanation of the referenced domain transition; not a new commit or backend call"
        }
      ],
      "advancePolicy": "Complete all visible explanatory subbeats before the next guided command; this is pacing, never a domain success gate."
    },
    {
      "checkpointId": "infra-exhaustion-recovery-04",
      "scenarioId": "infra-exhaustion-recovery",
      "chapterId": "infra-exhaustion-recovery:stage-2",
      "stateRef": "scenarios/infra-exhaustion-recovery.json#/checkpoints/4/expected",
      "previousCheckpointId": "infra-exhaustion-recovery-03",
      "headline": "Confirm the new instance is healthy",
      "motion": "confirm",
      "outcomeFields": [
        "workloadStatus",
        "nodeId",
        "clientAvailable",
        "blockedReasons"
      ],
      "defaultPhaseMs": {
        "orient": 400,
        "focus": 250,
        "action": 850,
        "settle": 1100
      },
      "microbeats": [
        {
          "id": "infra-exhaustion-recovery-04:beat-1",
          "label": "Allow traffic only after health is confirmed",
          "primaryActors": [
            "infra.workload",
            "infra.client"
          ],
          "routeKind": "traffic",
          "layout": "pair",
          "claim": "visual explanation of the referenced domain transition; not a new commit or backend call"
        }
      ],
      "advancePolicy": "Complete all visible explanatory subbeats before the next guided command; this is pacing, never a domain success gate."
    },
    {
      "checkpointId": "infra-exhaustion-recovery-05",
      "scenarioId": "infra-exhaustion-recovery",
      "chapterId": "infra-exhaustion-recovery:stage-3",
      "stateRef": "scenarios/infra-exhaustion-recovery.json#/checkpoints/5/expected",
      "previousCheckpointId": "infra-exhaustion-recovery-04",
      "headline": "The host fails; the instance stops",
      "motion": "interrupt",
      "outcomeFields": [
        "workloadStatus",
        "nodeId",
        "clientAvailable",
        "blockedReasons"
      ],
      "defaultPhaseMs": {
        "orient": 400,
        "focus": 250,
        "action": 850,
        "settle": 1100
      },
      "microbeats": [
        {
          "id": "infra-exhaustion-recovery-05:beat-1",
          "label": "Stop the instance on node-01",
          "primaryActors": [
            "infra.node-01",
            "infra.workload"
          ],
          "routeKind": "control",
          "layout": "pair",
          "claim": "visual explanation of the referenced domain transition; not a new commit or backend call"
        }
      ],
      "advancePolicy": "Complete all visible explanatory subbeats before the next guided command; this is pacing, never a domain success gate."
    },
    {
      "checkpointId": "infra-exhaustion-recovery-06",
      "scenarioId": "infra-exhaustion-recovery",
      "chapterId": "infra-exhaustion-recovery:stage-3",
      "stateRef": "scenarios/infra-exhaustion-recovery.json#/checkpoints/6/expected",
      "previousCheckpointId": "infra-exhaustion-recovery-05",
      "headline": "Exclude the previous owner",
      "motion": "guard",
      "outcomeFields": [
        "workloadStatus",
        "nodeId",
        "clientAvailable",
        "blockedReasons"
      ],
      "defaultPhaseMs": {
        "orient": 400,
        "focus": 250,
        "action": 850,
        "settle": 1100
      },
      "microbeats": [
        {
          "id": "infra-exhaustion-recovery-06:beat-1",
          "label": "Confirm exclusion before a restart",
          "primaryActors": [
            "infra.controller",
            "infra.workload"
          ],
          "routeKind": "control",
          "layout": "pair",
          "claim": "visual explanation of the referenced domain transition; not a new commit or backend call"
        }
      ],
      "advancePolicy": "Complete all visible explanatory subbeats before the next guided command; this is pacing, never a domain success gate."
    },
    {
      "checkpointId": "infra-exhaustion-recovery-07",
      "scenarioId": "infra-exhaustion-recovery",
      "chapterId": "infra-exhaustion-recovery:stage-3",
      "stateRef": "scenarios/infra-exhaustion-recovery.json#/checkpoints/7/expected",
      "previousCheckpointId": "infra-exhaustion-recovery-06",
      "headline": "Start a new instance on node-03",
      "motion": "restart",
      "outcomeFields": [
        "workloadStatus",
        "nodeId",
        "clientAvailable",
        "blockedReasons"
      ],